{"id":"writer-overlap","provenance":"simulation of user-described unregistered writer overlap (item 1)","expected_baseline_failure":true,"actions":[{"argv":["start","--spec","Two active writers must not edit overlapping source paths."]},{"argv":["spec-gate","SPEC_READY"]},{"argv":["classify","STANDARD","--designer","no","--implementers","al-engineer,al-builder"]},{"writes":[{"path":"manifest.json","content":{"schema_version":1,"base_oid":{"$state":"identity.merge_base"},"units":["."],"rules":[],"gates":[{"id":"lint-imports","category":"lint-imports","applicability":"NOT_APPLICABLE","required":false,"reason":"No unit-specific import contract applies in this fixture.","units":["."],"argv":[],"scope":["src.py"],"source":null,"execution_kind":"local","cwd":".","env_names":[]},{"id":"loc","category":"loc","applicability":"NOT_APPLICABLE","required":false,"reason":"No LOC rule applies in this fixture.","units":["."],"argv":[],"scope":["src.py"],"source":null,"execution_kind":"local","cwd":".","env_names":[]},{"id":"contracts","category":"contracts","applicability":"NOT_APPLICABLE","required":false,"reason":"No contract generation applies in this fixture.","units":["."],"argv":[],"scope":["src.py"],"source":null,"execution_kind":"local","cwd":".","env_names":[]},{"id":"pre-commit","category":"pre-commit","applicability":"NOT_APPLICABLE","required":false,"reason":"No staged hook applies in this fixture.","units":["."],"argv":[],"scope":["src.py"],"source":null,"execution_kind":"local","cwd":".","env_names":[]},{"id":"ci","category":"ci","applicability":"NOT_APPLICABLE","required":false,"reason":"No touched-unit CI job applies in this fixture.","units":["."],"argv":[],"scope":["src.py"],"source":null,"execution_kind":"local","cwd":".","env_names":[]}],"paths":["input.txt","src.py","manifest.json"]}}],"argv":["gates","plan","--file","$file:manifest.json"]},{"argv":["phase","IMPLEMENTATION"]},{"argv":["writer","start","--id","engineer","--role","al-engineer","--files","src.py"]},{"argv":["writer","start","--id","builder","--role","al-builder","--files","src.py"],"expected":"refuse","unchanged":true,"contains":"writer overlap"}]}
