{"id":"criterion-links","provenance":"simulation of missing acceptance-criterion-to-evidence traceability (item 4)","expected_baseline_failure":true,"actions":[{"argv":["start","--spec","AC-01 requires complete verification and a fresh review."]},{"argv":["spec-gate","SPEC_READY"]},{"argv":["classify","SMALL","--designer","no","--implementers","al-engineer"]},{"writes":[{"path":"runtime/gates.json","content":{"schema_version":1,"base_oid":{"$state":"identity.merge_base"},"units":["."],"rules":[],"gates":[{"id":"lint-imports","category":"lint-imports","applicability":"NOT_APPLICABLE","required":false,"reason":"No repository obligation of this category applies in this fixture.","units":["."],"argv":[],"scope":["input.txt"],"source":null,"execution_kind":"local","cwd":".","env_names":[]},{"id":"loc","category":"loc","applicability":"NOT_APPLICABLE","required":false,"reason":"No repository obligation of this category applies in this fixture.","units":["."],"argv":[],"scope":["input.txt"],"source":null,"execution_kind":"local","cwd":".","env_names":[]},{"id":"contracts","category":"contracts","applicability":"NOT_APPLICABLE","required":false,"reason":"No repository obligation of this category applies in this fixture.","units":["."],"argv":[],"scope":["input.txt"],"source":null,"execution_kind":"local","cwd":".","env_names":[]},{"id":"pre-commit","category":"pre-commit","applicability":"NOT_APPLICABLE","required":false,"reason":"No repository obligation of this category applies in this fixture.","units":["."],"argv":[],"scope":["input.txt"],"source":null,"execution_kind":"local","cwd":".","env_names":[]},{"id":"ci","category":"ci","applicability":"NOT_APPLICABLE","required":false,"reason":"No repository obligation of this category applies in this fixture.","units":["."],"argv":[],"scope":["input.txt"],"source":null,"execution_kind":"local","cwd":".","env_names":[]}],"paths":["input.txt"]}}],"argv":["gates","plan","--file","$file:runtime/gates.json"]},{"argv":["phase","IMPLEMENTATION"]},{"argv":["writer","start","--id","engineer","--role","al-engineer","--files","input.txt"]},{"argv":["writer","finish","--id","engineer","--outcome","success"]},{"argv":["phase","VERIFICATION"]},{"argv":["evidence","plan","--area","unit","--tier","broad","--kind","check","--scope","input.txt","--","$python","-c","print(\"verified\")"]},{"argv":["evidence","run","--area","unit"]},{"argv":["review-start"]},{"argv":["review-packet","--stage","fresh"]},{"writes":[{"path":"runtime/fresh.json","content":{"schema_version":1,"review_id":{"$state":"review.id"},"stage":"fresh","reviewer_role":"al-architect","model":{"$state":"model"},"invocation_id":"fresh-invocation","candidate_hash":{"$state":"review.candidate.fingerprint"},"task_hash":{"$state":"review.task_hash"},"packet_hash":{"$state":"review.packets.fresh.sha256"},"inspected_artifacts":[{"$state":"review.packets.fresh.sha256"}],"criteria":[{"id":"AC-01","status":"SATISFIED","rationale":"The selected criterion is implemented in the candidate.","locations":["input.txt:1"],"evidence":[]}],"findings":[],"prior_resolutions":[],"plan_defects":[],"status":"APPROVED","assessments":{"rollout":{"applicable":false,"reason":"No deployment surface applies in this scenario."},"ui":{"applicable":false,"reason":"No rendered surface applies in this scenario."}}}}],"argv":["review-fresh","--file","$file:runtime/fresh.json"],"expected":"refuse","contains":"traceability requires verification IDs"}]}
