{"id":"baseline-gate-regression","provenance":"simulation of a generated contract change that must be detected on the isolated base checkout (item 2)","expected_baseline_failure":true,"actions":[{"argv":["start","--spec","Base generation checks must preserve source content and report drift."]},{"writes":[{"path":"runtime/gates.json","content":{"schema_version":1,"base_oid":{"$state":"identity.merge_base"},"units":["."],"rules":[],"gates":[{"id":"lint-imports","category":"lint-imports","applicability":"NOT_APPLICABLE","required":false,"reason":"No obligation applies in this fixture.","units":["."],"argv":[],"scope":["input.txt"],"source":null,"execution_kind":"local","cwd":".","env_names":[]},{"id":"loc","category":"loc","applicability":"NOT_APPLICABLE","required":false,"reason":"No obligation applies in this fixture.","units":["."],"argv":[],"scope":["input.txt"],"source":null,"execution_kind":"local","cwd":".","env_names":[]},{"id":"contracts","category":"contracts","applicability":"APPLICABLE","required":true,"reason":"Generation gate exercises isolated base drift.","units":["."],"argv":["$python","-c","from pathlib import Path; Path('input.txt').write_text('generated\\n')"],"scope":["input.txt"],"source":{"path":"input.txt","sha256":"e7d8f422188dc6072d60f8c9bb4f2408bd582546ef5a6629a71718bf3e8bcb80"},"execution_kind":"local","cwd":".","env_names":[]},{"id":"pre-commit","category":"pre-commit","applicability":"NOT_APPLICABLE","required":false,"reason":"No obligation applies in this fixture.","units":["."],"argv":[],"scope":["input.txt"],"source":null,"execution_kind":"local","cwd":".","env_names":[]},{"id":"ci","category":"ci","applicability":"NOT_APPLICABLE","required":false,"reason":"No obligation applies in this fixture.","units":["."],"argv":[],"scope":["input.txt"],"source":null,"execution_kind":"local","cwd":".","env_names":[]}],"paths":["input.txt"]}}],"argv":["gates","plan","--file","$file:runtime/gates.json"]},{"argv":["gates","run","--stage","base","--id","contracts"],"expected":"refuse","contains":"FAIL"}]}
