{"id":"red-repro","provenance":"simulation of the rework red-to-green proof loop (item 1)","expected_baseline_failure":true,"actions":[{"argv":["start","--spec","A failing check demonstrates a real pre-review defect and must be resolved."]},{"argv":["spec-gate","SPEC_READY"]},{"argv":["classify","SMALL","--designer","no","--implementers","al-engineer"]},{"writes":[{"path":"runtime/gates.json","content":{"schema_version":1,"base_oid":{"$state":"identity.merge_base"},"units":["."],"rules":[],"gates":[{"id":"lint-imports","category":"lint-imports","applicability":"NOT_APPLICABLE","required":false,"reason":"No repository obligation of this category applies in this fixture.","units":["."],"argv":[],"scope":["input.txt"],"source":null,"execution_kind":"local","cwd":".","env_names":[]},{"id":"loc","category":"loc","applicability":"NOT_APPLICABLE","required":false,"reason":"No repository obligation of this category applies in this fixture.","units":["."],"argv":[],"scope":["input.txt"],"source":null,"execution_kind":"local","cwd":".","env_names":[]},{"id":"contracts","category":"contracts","applicability":"NOT_APPLICABLE","required":false,"reason":"No repository obligation of this category applies in this fixture.","units":["."],"argv":[],"scope":["input.txt"],"source":null,"execution_kind":"local","cwd":".","env_names":[]},{"id":"pre-commit","category":"pre-commit","applicability":"NOT_APPLICABLE","required":false,"reason":"No repository obligation of this category applies in this fixture.","units":["."],"argv":[],"scope":["input.txt"],"source":null,"execution_kind":"local","cwd":".","env_names":[]},{"id":"ci","category":"ci","applicability":"NOT_APPLICABLE","required":false,"reason":"No repository obligation of this category applies in this fixture.","units":["."],"argv":[],"scope":["input.txt"],"source":null,"execution_kind":"local","cwd":".","env_names":[]}],"paths":["input.txt"]}}],"argv":["gates","plan","--file","$file:runtime/gates.json"]},{"argv":["phase","IMPLEMENTATION"]},{"argv":["writer","start","--id","engineer","--role","al-engineer","--files","input.txt"]},{"argv":["writer","finish","--id","engineer","--outcome","success"]},{"argv":["phase","VERIFICATION"]},{"argv":["evidence","plan","--area","repro","--tier","focused","--kind","check","--scope","input.txt","--","$python","-c","import sys;sys.exit(1)"]},{"argv":["evidence","run","--area","repro"],"expected":"refuse","contains":"FAIL"},{"argv":["rework","--source","verification","--findings","1","--repro",{"$state":"evidence.entries.0.id"},"--cause-demonstrated","yes","--local","yes","--contract-change","no","--scope-ambiguous","no","--safety-decision","no","--spec-conflict","no"]},{"argv":["evidence","require","--tier","broad"],"expected":"refuse","contains":"repro"}]}
