{"id":"repeated-mr-fixes","provenance":"simulation of the full selected merge-request diff across a correction round (item 5)","expected_baseline_failure":true,"files":{"input.txt":"earlier candidate fix\n"},"actions":[{"argv":["start","--review-mode","whole-mr","--target","HEAD","--spec","AC-01 tracks an earlier whole-MR correction and a new fix."]},{"argv":["spec-gate","SPEC_READY"]},{"argv":["classify","SMALL","--designer","no","--implementers","al-engineer"]},{"writes":[{"path":"runtime/gates.json","content":{"schema_version":1,"base_oid":{"$state":"identity.merge_base"},"units":["."],"rules":[],"gates":[{"id":"lint-imports","category":"lint-imports","applicability":"NOT_APPLICABLE","required":false,"reason":"No repository obligation of this category applies in this fixture.","units":["."],"argv":[],"scope":["input.txt"],"source":null,"execution_kind":"local","cwd":".","env_names":[]},{"id":"loc","category":"loc","applicability":"NOT_APPLICABLE","required":false,"reason":"No repository obligation of this category applies in this fixture.","units":["."],"argv":[],"scope":["input.txt"],"source":null,"execution_kind":"local","cwd":".","env_names":[]},{"id":"contracts","category":"contracts","applicability":"NOT_APPLICABLE","required":false,"reason":"No repository obligation of this category applies in this fixture.","units":["."],"argv":[],"scope":["input.txt"],"source":null,"execution_kind":"local","cwd":".","env_names":[]},{"id":"pre-commit","category":"pre-commit","applicability":"NOT_APPLICABLE","required":false,"reason":"No repository obligation of this category applies in this fixture.","units":["."],"argv":[],"scope":["input.txt"],"source":null,"execution_kind":"local","cwd":".","env_names":[]},{"id":"ci","category":"ci","applicability":"NOT_APPLICABLE","required":false,"reason":"No repository obligation of this category applies in this fixture.","units":["."],"argv":[],"scope":["input.txt"],"source":null,"execution_kind":"local","cwd":".","env_names":[]}],"paths":["input.txt"]}}],"argv":["gates","plan","--file","$file:runtime/gates.json"]},{"argv":["phase","IMPLEMENTATION"]},{"argv":["writer","start","--id","engineer","--role","al-engineer","--files","input.txt"]},{"argv":["writer","finish","--id","engineer","--outcome","success"]},{"argv":["phase","VERIFICATION"]},{"argv":["evidence","plan","--area","unit","--tier","broad","--kind","check","--scope","input.txt","--","$python","-c","print(\"verified\")"]},{"argv":["evidence","run","--area","unit"]},{"argv":["review-start"]},{"argv":["review-packet","--stage","fresh"]},{"writes":[{"path":"runtime/fresh.json","content":{"schema_version":1,"review_id":{"$state":"review.id"},"stage":"fresh","reviewer_role":"al-architect","model":{"$state":"model"},"invocation_id":"fresh-invocation","candidate_hash":{"$state":"review.candidate.fingerprint"},"task_hash":{"$state":"review.task_hash"},"packet_hash":{"$state":"review.packets.fresh.sha256"},"inspected_artifacts":[{"$state":"review.packets.fresh.sha256"}],"criteria":[{"id":"AC-01","status":"SATISFIED","rationale":"The selected criterion is implemented in the candidate.","locations":["input.txt:1"],"evidence":[{"$state":"evidence.entries.0.id"}]}],"findings":[],"prior_resolutions":[],"plan_defects":[],"status":"APPROVED","assessments":{"rollout":{"applicable":false,"reason":"No deployment surface applies in this scenario."},"ui":{"applicable":false,"reason":"No rendered surface applies in this scenario."}}}}],"argv":["review-fresh","--file","$file:runtime/fresh.json"]},{"argv":["review-compare-start","--plan","$file:runtime/approved-plan.md"],"writes":[{"path":"runtime/approved-plan.md","content":"Approved replay plan: verify the complete selected candidate and failure paths."}]},{"argv":["review-packet","--stage","compare"]},{"writes":[{"path":"runtime/compare.json","content":{"schema_version":1,"review_id":{"$state":"review.id"},"stage":"compare","reviewer_role":"al-architect","model":{"$state":"model"},"invocation_id":"compare-round-1","candidate_hash":{"$state":"review.candidate.fingerprint"},"task_hash":{"$state":"review.task_hash"},"packet_hash":{"$state":"review.packets.compare.sha256"},"inspected_artifacts":[{"$state":"review.packets.compare.sha256"},{"$state":"review.comparison_inputs.plan.sha256"}],"criteria":[{"id":"AC-01","status":"SATISFIED","rationale":"The selected criterion is implemented in the candidate.","locations":["input.txt:1"],"evidence":[{"$state":"evidence.entries.0.id"}]}],"findings":[{"id":"F-1","source":"AC-01","severity":"BLOCKING","description":"The earlier candidate fix is incomplete."}],"prior_resolutions":[],"plan_defects":[],"status":"CHANGES_REQUIRED","assessments":{"rollout":{"applicable":false,"reason":"No deployment surface applies in this scenario."},"ui":{"applicable":false,"reason":"No rendered surface applies in this scenario."}}}}],"argv":["review-result","--file","$file:runtime/compare.json"]},{"argv":["correction","--route","al-engineer"]},{"argv":["writer","start","--id","correction","--role","al-engineer","--files","input.txt"]},{"writes":[{"path":"input.txt","content":"earlier fix retained; latest correction applied\n"}],"argv":["writer","finish","--id","correction","--outcome","success"]},{"argv":["phase","VERIFICATION"]},{"argv":["evidence","plan","--area","unit","--tier","broad","--kind","check","--scope","input.txt","--","$python","-c","print(\"corrected candidate verified\")"]},{"argv":["evidence","run","--area","unit","--fresh"]},{"argv":["review-start"]},{"argv":["review-packet","--stage","fresh"]},{"writes":[{"path":"runtime/fresh.json","content":{"schema_version":1,"review_id":{"$state":"review.id"},"stage":"fresh","reviewer_role":"al-architect","model":{"$state":"model"},"invocation_id":"fresh-round-2","candidate_hash":{"$state":"review.candidate.fingerprint"},"task_hash":{"$state":"review.task_hash"},"packet_hash":{"$state":"review.packets.fresh.sha256"},"inspected_artifacts":[{"$state":"review.packets.fresh.sha256"}],"criteria":[{"id":"AC-01","status":"SATISFIED","rationale":"The selected criterion is implemented in the candidate.","locations":["input.txt:1"],"evidence":[{"$state":"evidence.entries.1.id"}]}],"findings":[],"prior_resolutions":[],"plan_defects":[],"status":"APPROVED","assessments":{"rollout":{"applicable":false,"reason":"No deployment surface applies in this scenario."},"ui":{"applicable":false,"reason":"No rendered surface applies in this scenario."}}}}],"argv":["review-fresh","--file","$file:runtime/fresh.json"]},{"argv":["review-compare-start","--plan","$file:runtime/approved-plan.md"],"writes":[{"path":"runtime/approved-plan.md","content":"Approved replay plan: verify the complete selected candidate and failure paths."}]},{"argv":["review-packet","--stage","compare"]},{"writes":[{"path":"runtime/compare.json","content":{"schema_version":1,"review_id":{"$state":"review.id"},"stage":"compare","reviewer_role":"al-architect","model":{"$state":"model"},"invocation_id":"compare-round-2","candidate_hash":{"$state":"review.candidate.fingerprint"},"task_hash":{"$state":"review.task_hash"},"packet_hash":{"$state":"review.packets.compare.sha256"},"inspected_artifacts":[{"$state":"review.packets.compare.sha256"},{"$state":"review.comparison_inputs.plan.sha256"}],"criteria":[{"id":"AC-01","status":"SATISFIED","rationale":"The selected criterion is implemented in the candidate.","locations":["input.txt:1"],"evidence":[{"$state":"evidence.entries.1.id"}]}],"findings":[],"prior_resolutions":[{"id":"F-1","source":"AC-01","rationale":"The second review confirms the blocking issue is fixed in the full selected diff.","locations":["input.txt:1"],"evidence":[{"$state":"evidence.entries.1.id"}],"status":"fixed"}],"plan_defects":[],"status":"APPROVED","assessments":{"rollout":{"applicable":false,"reason":"No deployment surface applies in this scenario."},"ui":{"applicable":false,"reason":"No rendered surface applies in this scenario."}}}}],"argv":["review-result","--file","$file:runtime/compare.json"]},{"argv":["phase","FINAL_VERIFICATION"]},{"argv":["approved"]}]}
