{"id":"harmless-searches","provenance":"simulation of user-described search-term false positives in the parsed command guard (item 8)","expected_baseline_failure":false,"baseline_comparison":"unavailable: the preserved baseline has no shared parser interface","commands":{"readonly":["rg 'git reset > cp --fix' .","find . -name \"cp --fix\"","find . -name '-delete'","find . -iname '-exec' -print","find . -regex '-fprint'","find -L . -name '-delete'","git log --grep='git reset > cp'"],"shared":["rg 'git reset > cp --fix' .","find . -name \"cp --fix\"","find . -name '-delete'","find . -iname '-exec' -print","find . -regex '-fprint'","find -L . -name '-delete'","git log --grep='git reset > cp'"]},"actions":[{"argv":["start","--spec","Preserve harmless search examples containing git reset, cp, and find actions in evidence text."]},{"argv":["show","--line"]}]}
